{
  "schema_version": "2",
  "backend": "llamacpp",
  "machine": {
    "host": "ryzen-7-255",
    "os": "linux",
    "cpu": "AMD Ryzen 7 255 w/ Radeon 780M Graphics",
    "cpu_cores": 8,
    "cpu_threads": 16,
    "gpus": [],
    "memory": {
      "total_gb": 13.4,
      "channels": null,
      "configured_mts": null,
      "rated_mts": null,
      "rank": null,
      "dimms": null
    }
  },
  "job_spawns": 1,
  "probes": [
    {
      "provider": "vulkan:0",
      "device": "AMD Radeon Graphics (RADV PHOENIX)",
      "status": "ok",
      "threads": {
        "decode": 8,
        "batch": 8
      },
      "gemm": [
        {
          "m": 4096,
          "n": 512,
          "k": 4096,
          "dtype": "f16",
          "tflops_p50": 1.53,
          "n_reps": 3
        },
        {
          "m": 8192,
          "n": 512,
          "k": 8192,
          "dtype": "f16",
          "tflops_p50": 3.5,
          "n_reps": 5
        }
      ],
      "copy": [
        {
          "kind": "h2d",
          "bytes": 268435456,
          "gbs_p50": 12.89,
          "n_reps": 3
        },
        {
          "kind": "d2h",
          "bytes": 268435456,
          "gbs_p50": 4.67,
          "n_reps": 3
        },
        {
          "kind": "d2d",
          "bytes": 268435456,
          "gbs_p50": 63.97,
          "n_reps": 3
        }
      ]
    },
    {
      "provider": "cpu:0",
      "device": "AMD Ryzen 7 255 w/ Radeon 780M Graphics",
      "status": "ok",
      "threads": {
        "decode": 8,
        "batch": 8
      },
      "gemm": [
        {
          "m": 4096,
          "n": 512,
          "k": 4096,
          "dtype": "f16",
          "tflops_p50": 0.41,
          "n_reps": 3
        },
        {
          "m": 8192,
          "n": 512,
          "k": 8192,
          "dtype": "f16",
          "tflops_p50": 0.41,
          "n_reps": 3
        }
      ],
      "copy": [
        {
          "kind": "h2d",
          "bytes": 268435456,
          "gbs_p50": 5.57,
          "n_reps": 3
        },
        {
          "kind": "d2h",
          "bytes": 268435456,
          "gbs_p50": 22.3,
          "n_reps": 3
        },
        {
          "kind": "d2d",
          "bytes": 268435456,
          "gbs_p50": 48.36,
          "n_reps": 3
        }
      ]
    }
  ],
  "runs": [
    {
      "provider": "vulkan:0",
      "device": "AMD Radeon Graphics (RADV PHOENIX)",
      "model": "Ministral3-3B",
      "quant": "q4",
      "healthy": true,
      "vram_method": "drm",
      "threads": {
        "decode": 8,
        "batch": 8
      },
      "geometry": {
        "n_layer": 26,
        "n_embd": 3072,
        "n_head": 32,
        "n_head_kv": 8,
        "n_swa": 0,
        "shared_kv_layers": 0,
        "n_ctx_train": 262144,
        "n_params": 3429006336,
        "file_bytes": 2147023008,
        "context": {
          "n_ctx": 8320,
          "n_batch": 8320,
          "n_ubatch": 512
        },
        "layers": [
          {
            "kind": "full",
            "window": 0
          },
          {
            "kind": "full",
            "window": 0
          },
          {
            "kind": "full",
            "window": 0
          },
          {
            "kind": "full",
            "window": 0
          },
          {
            "kind": "full",
            "window": 0
          },
          {
            "kind": "full",
            "window": 0
          },
          {
            "kind": "full",
            "window": 0
          },
          {
            "kind": "full",
            "window": 0
          },
          {
            "kind": "full",
            "window": 0
          },
          {
            "kind": "full",
            "window": 0
          },
          {
            "kind": "full",
            "window": 0
          },
          {
            "kind": "full",
            "window": 0
          },
          {
            "kind": "full",
            "window": 0
          },
          {
            "kind": "full",
            "window": 0
          },
          {
            "kind": "full",
            "window": 0
          },
          {
            "kind": "full",
            "window": 0
          },
          {
            "kind": "full",
            "window": 0
          },
          {
            "kind": "full",
            "window": 0
          },
          {
            "kind": "full",
            "window": 0
          },
          {
            "kind": "full",
            "window": 0
          },
          {
            "kind": "full",
            "window": 0
          },
          {
            "kind": "full",
            "window": 0
          },
          {
            "kind": "full",
            "window": 0
          },
          {
            "kind": "full",
            "window": 0
          },
          {
            "kind": "full",
            "window": 0
          },
          {
            "kind": "full",
            "window": 0
          }
        ],
        "tensors": {
          "embedding": {
            "params": 402653184,
            "bytes": 330301440
          },
          "body": {
            "params": 3026350080,
            "bytes": 1808302080
          },
          "head": {
            "params": 3072,
            "bytes": 12288
          },
          "tied_head": true
        },
        "buffers": [
          {
            "name": "Vulkan0",
            "model_bytes": 2138615808,
            "context_bytes": 899678208,
            "compute_bytes": 274726912
          },
          {
            "name": "Vulkan_Host",
            "model_bytes": 330301472,
            "context_bytes": 0,
            "compute_bytes": 21258272
          }
        ],
        "memory_points": [
          {
            "n_ctx": 512,
            "n_batch": 512,
            "n_ubatch": 512,
            "buffers": [
              {
                "name": "Vulkan0",
                "model_bytes": 2138615808,
                "context_bytes": 54525952,
                "compute_bytes": 274726912
              },
              {
                "name": "Vulkan_Host",
                "model_bytes": 330301472,
                "context_bytes": 0,
                "compute_bytes": 13131808
              }
            ]
          },
          {
            "n_ctx": 2048,
            "n_batch": 2048,
            "n_ubatch": 512,
            "buffers": [
              {
                "name": "Vulkan0",
                "model_bytes": 2138615808,
                "context_bytes": 218103808,
                "compute_bytes": 274726912
              },
              {
                "name": "Vulkan_Host",
                "model_bytes": 330301472,
                "context_bytes": 0,
                "compute_bytes": 14704672
              }
            ]
          },
          {
            "n_ctx": 8192,
            "n_batch": 8192,
            "n_ubatch": 512,
            "buffers": [
              {
                "name": "Vulkan0",
                "model_bytes": 2138615808,
                "context_bytes": 872415232,
                "compute_bytes": 274726912
              },
              {
                "name": "Vulkan_Host",
                "model_bytes": 330301472,
                "context_bytes": 0,
                "compute_bytes": 20996128
              }
            ]
          }
        ]
      },
      "sweep": {
        "status": "ok",
        "prefill": [
          {
            "context": 0,
            "tokens": 512,
            "ms": 970.82
          },
          {
            "context": 512,
            "tokens": 512,
            "ms": 980.78
          },
          {
            "context": 1024,
            "tokens": 256,
            "ms": 516.57
          },
          {
            "context": 1280,
            "tokens": 256,
            "ms": 530.33
          },
          {
            "context": 1536,
            "tokens": 512,
            "ms": 1150.13
          },
          {
            "context": 2048,
            "tokens": 512,
            "ms": 1250.4
          },
          {
            "context": 2560,
            "tokens": 512,
            "ms": 1385.56
          },
          {
            "context": 3072,
            "tokens": 512,
            "ms": 1516.59
          },
          {
            "context": 3584,
            "tokens": 512,
            "ms": 1656.87
          },
          {
            "context": 4096,
            "tokens": 512,
            "ms": 1893.01
          },
          {
            "context": 4608,
            "tokens": 512,
            "ms": 2094.9
          },
          {
            "context": 5120,
            "tokens": 256,
            "ms": 925.72
          },
          {
            "context": 5376,
            "tokens": 256,
            "ms": 984.57
          },
          {
            "context": 5632,
            "tokens": 512,
            "ms": 2500.09
          },
          {
            "context": 6144,
            "tokens": 512,
            "ms": 2987.67
          },
          {
            "context": 6656,
            "tokens": 512,
            "ms": 3189.41
          },
          {
            "context": 7168,
            "tokens": 512,
            "ms": 3333.55
          },
          {
            "context": 7680,
            "tokens": 512,
            "ms": 3699.78
          }
        ],
        "decode": [
          {
            "kv_fill": 8192,
            "tokens": 64,
            "tps_p50": 22.04,
            "tps_min": 22.04,
            "tps_max": 22.04,
            "n_reps": 1
          },
          {
            "kv_fill": 2048,
            "tokens": 64,
            "tps_p50": 28.03,
            "tps_min": 28.03,
            "tps_max": 28.03,
            "n_reps": 1
          },
          {
            "kv_fill": 0,
            "tokens": 64,
            "tps_p50": 31.02,
            "tps_min": 31.02,
            "tps_max": 31.02,
            "n_reps": 1
          }
        ],
        "fit": {
          "width": 512,